{
  "id": "01M5W9Y88K23T1N71WX7PYTAYY",
  "source_id": "33194b31-7da4-486e-aa9f-08e1f156aa7c:0",
  "name": null,
  "type": "residential",
  "coordinates": [
    [
      81.7373704,
      7.6777785
    ],
    [
      81.7371817,
      7.6779619
    ],
    [
      81.7371493,
      7.6779807
    ]
  ]
}
