{
  "id": "01M5W9YB39AHA6GGMF21SA8GB9",
  "source_id": "5ccb7348-198b-4183-9d4f-0043922298cc:0",
  "name": null,
  "type": "residential",
  "coordinates": [
    [
      81.7322517,
      7.689786
    ],
    [
      81.7322791,
      7.6897287
    ],
    [
      81.7323697,
      7.6895684
    ]
  ]
}
