{
  "id": "01M5W9Z0C7M9SSSHTHRTHV2QGV",
  "source_id": "e8b2f977-1b55-4697-bf49-bf76334cdc06:0",
  "name": null,
  "type": "residential",
  "coordinates": [
    [
      81.7333419,
      7.6789573
    ],
    [
      81.7336122,
      7.679168
    ],
    [
      81.7339032,
      7.6793714
    ],
    [
      81.7340775,
      7.679467
    ]
  ]
}
