{
  "id": "01M5W9Y74NM8GZY5YCW9XVQC4G",
  "source_id": "1024c445-0554-4b0f-860f-152c6f714558:0",
  "name": "Old Kalmunai Road",
  "type": "primary",
  "coordinates": [
    [
      81.7100535,
      7.7123982
    ],
    [
      81.7101101,
      7.7124069
    ],
    [
      81.7102237,
      7.7124386
    ]
  ]
}
