{
  "id": "01M5W9Y6Z3A297SD5DF4YAWBQP",
  "source_id": "02b9eb97-c2fe-43a6-a911-0ef426684519:0",
  "name": null,
  "type": "residential",
  "coordinates": [
    [
      81.7277196,
      7.6863561
    ],
    [
      81.728026,
      7.685957
    ],
    [
      81.7281219,
      7.6858341
    ]
  ]
}
