{
  "id": "01M5W9Y8PVBDTGVX37F3YN3B0R",
  "source_id": "3e15ea0b-b0b6-44f2-9501-f91b787076f0:0",
  "name": null,
  "type": "residential",
  "coordinates": [
    [
      81.7345703,
      7.693524
    ],
    [
      81.7345475,
      7.6935127
    ],
    [
      81.7342321,
      7.6932107
    ]
  ]
}
