{
  "id": "01M5W9Z4PNK5ARB597DNN1F7DH",
  "source_id": "fa4e298c-1e82-4e59-a050-464d97396cc2:0",
  "name": null,
  "type": "residential",
  "coordinates": [
    [
      81.7404292,
      7.6743255
    ],
    [
      81.7407261,
      7.6740099
    ],
    [
      81.7408884,
      7.6738331
    ],
    [
      81.7410479,
      7.6737002
    ],
    [
      81.7411766,
      7.6736085
    ],
    [
      81.741284,
      7.6736497
    ],
    [
      81.7414007,
      7.6737149
    ],
    [
      81.7416183,
      7.673803
    ]
  ]
}
