{
  "id": "01M5W9Y70A60A4YFGZ8YFAJ57Y",
  "source_id": "07681005-fb37-4ea6-9d50-2c3b60a77fd0:0",
  "name": null,
  "type": "residential",
  "coordinates": [
    [
      81.7385538,
      7.6888477
    ],
    [
      81.7380699,
      7.6885548
    ],
    [
      81.7377754,
      7.6884248
    ]
  ]
}
