{
  "id": "01M5W9YNGST2YB90HP3GYX5MJJ",
  "source_id": "acbdd685-6a1b-4649-b2bd-11a10f4317b6:0",
  "name": null,
  "type": "residential",
  "coordinates": [
    [
      81.7277771,
      7.696453
    ],
    [
      81.727559,
      7.6963407
    ],
    [
      81.7271489,
      7.6961252
    ]
  ]
}
