{
  "id": "01M5W9YD5HFHMHB7D1M2S1C1P1",
  "source_id": "71cc3745-16fc-4ce3-a6f3-cf0b0a7418e8:0",
  "name": "New Kalmunai Road",
  "type": "trunk",
  "coordinates": [
    [
      81.7404236,
      7.6619428
    ],
    [
      81.7403993,
      7.6623245
    ],
    [
      81.7403783,
      7.6625001
    ],
    [
      81.7403514,
      7.6626145
    ]
  ]
}
