{
  "id": "01M5W9YGDEJ66XMJYBBWY05EDG",
  "source_id": "8956a3af-eb58-4189-99c6-10ff1de88966:0",
  "name": null,
  "type": "residential",
  "coordinates": [
    [
      81.7329684,
      7.6973511
    ],
    [
      81.7319895,
      7.6968498
    ],
    [
      81.7314959,
      7.6966145
    ],
    [
      81.7309655,
      7.6963321
    ],
    [
      81.7307851,
      7.6962324
    ]
  ]
}
