{
  "id": "01M5W9Z5XQFKV518SPPYV01GMR",
  "source_id": "ffffdfe7-23d4-4267-a02c-4a1fa71c9ddf:0",
  "name": null,
  "type": "residential",
  "coordinates": [
    [
      81.7362963,
      7.6717372
    ],
    [
      81.7364052,
      7.6714794
    ],
    [
      81.7366851,
      7.6708576
    ]
  ]
}
