{
  "id": "01M5W9YQ8F4ESFYHG6S9QX9PTZ",
  "source_id": "b7cc6632-ae37-47c8-bc47-fa6506230385:0",
  "name": null,
  "type": "residential",
  "coordinates": [
    [
      81.7486355,
      7.6617162
    ],
    [
      81.7487636,
      7.6617828
    ],
    [
      81.7486926,
      7.6620606
    ],
    [
      81.7486262,
      7.6624019
    ]
  ]
}
