{
  "id": "01M5W9YCF4CS9E3E2CM21AQAQ5",
  "source_id": "6c48faae-c8ff-4aa9-be9c-f0ddb8cbce0b:0",
  "name": null,
  "type": "residential",
  "coordinates": [
    [
      81.7371493,
      7.6779807
    ],
    [
      81.7371001,
      7.6779273
    ],
    [
      81.7369955,
      7.677809
    ],
    [
      81.7369297,
      7.6776482
    ],
    [
      81.7368372,
      7.6775684
    ],
    [
      81.7365247,
      7.6774046
    ],
    [
      81.7366296,
      7.6769977
    ]
  ]
}
