{
  "id": "01M5W9YN3ZYW2DPEQZJ7F06NK2",
  "source_id": "a9dbdef8-5792-41c9-8b44-d0022411301e:0",
  "name": null,
  "type": "residential",
  "coordinates": [
    [
      81.7336329,
      7.6777351
    ],
    [
      81.7335869,
      7.6777062
    ],
    [
      81.7333227,
      7.6775401
    ],
    [
      81.7331024,
      7.6774346
    ]
  ]
}
