{
  "id": "01M5W9YCEN7Z5RE00F0WCK4BB8",
  "source_id": "6c171c8e-c024-498d-8a93-ec26bc268daf:0",
  "name": null,
  "type": "residential",
  "coordinates": [
    [
      81.7369463,
      7.6699489
    ],
    [
      81.7371024,
      7.6691168
    ],
    [
      81.7371138,
      7.6690956
    ],
    [
      81.7371413,
      7.6690849
    ],
    [
      81.7371909,
      7.6690756
    ],
    [
      81.7372084,
      7.6690657
    ],
    [
      81.7372204,
      7.6690304
    ],
    [
      81.7372739,
      7.6688839
    ]
  ]
}
