{
  "id": "01M5W9YD4NG72X2QC87SGDCX64",
  "source_id": "71b0b421-69a8-478f-bb1e-20d7b81147e0:0",
  "name": null,
  "type": "track",
  "coordinates": [
    [
      81.7260481,
      7.6771455
    ],
    [
      81.7259619,
      7.6771161
    ],
    [
      81.7257547,
      7.6770583
    ],
    [
      81.7257574,
      7.6770423
    ],
    [
      81.7256079,
      7.6769885
    ],
    [
      81.7256186,
      7.6769526
    ],
    [
      81.7254054,
      7.6768536
    ],
    [
      81.7250506,
      7.6767233
    ],
    [
      81.7249936,
      7.6767213
    ],
    [
      81.724884,
      7.6766616
    ]
  ]
}
