{
  "id": "01M5W9Y9G613ENSNVM7JPVKKSJ",
  "source_id": "4828fd1f-3785-4e69-a16b-9c21c21e0ae7:0",
  "name": null,
  "type": "residential",
  "coordinates": [
    [
      81.7418286,
      7.6749685
    ],
    [
      81.7415201,
      7.6748296
    ],
    [
      81.7409263,
      7.6745548
    ]
  ]
}
