{
  "id": "01M5W9YCBCQ025SM4PMG7PNB63",
  "source_id": "6b8c68a0-bd7f-49a8-ac4e-5c11bbf4babf:0",
  "name": null,
  "type": "residential",
  "coordinates": [
    [
      81.7255375,
      7.6618697
    ],
    [
      81.7259114,
      7.6615907
    ],
    [
      81.7263966,
      7.6613747
    ]
  ]
}
