{
  "id": "01M5W9YSDQGKG8F5EC0WQTVWYV",
  "source_id": "c303dc60-b52d-45b2-9427-1385c482e072:0",
  "name": null,
  "type": "residential",
  "coordinates": [
    [
      81.7300224,
      7.6715368
    ],
    [
      81.7298538,
      7.6719279
    ],
    [
      81.7298082,
      7.6719173
    ]
  ]
}
